{
  "contract_version": 1,
  "suite": "trakt_scrobble_policy",
  "case_id": "stop_at_80_marks_watched",
  "now_ms": 1739923200000,
  "input": {
    "stage": "stop",
    "progress_percent": 80
  },
  "expected": {
    "endpoint": "/scrobble/stop",
    "marks_watched": true,
    "updates_playback_progress": false
  }
}
